{
  "schema_version": "1.0",
  "source": {
    "url": "https://openrouter.ai/api/v1/models?output_modalities=all",
    "fetched_at": "2026-10-20T07:00:12+00:00",
    "response_sha256": "20b361fc2254d450c0fd295a2a546ef0c5ef3ebce89d89abb1d7635074ba5b6f"
  },
  "model_count": 685,
  "models": {
    "aion-labs/aion-2.0": "AionLabs: Aion-2.0",
    "aion-labs/aion-3.0": "AionLabs: Aion-3.0",
    "aion-labs/aion-3.0-mini": "AionLabs: Aion-3.0-Mini",
    "aion-labs/aion-3.5": "AionLabs: Aion 3.5",
    "aion-labs/aion-3.5-mini": "AionLabs: Aion 3.5 Mini",
    "aion-labs/aion-rp-llama-3.1-8b": "AionLabs: Aion-RP 1.0 (8B)",
    "alibaba/happyhorse-1.0": "Alibaba: HappyHorse 1.0",
    "alibaba/happyhorse-1.1": "Alibaba: HappyHorse 1.1",
    "alibaba/wan-2.6": "Alibaba: Wan 2.6",
    "alibaba/wan-2.7": "Alibaba: Wan 2.7",
    "alibaba/wan-3.0": "Alibaba: Wan 3.0",
    "alibaba/wan-3.0-prime": "Alibaba: Wan 3.0 Prime",
    "amazon/nova-2-lite-v1": "Amazon: Nova 2 Lite",
    "amazon/nova-lite-v1": "Amazon: Nova Lite 1.0",
    "amazon/nova-micro-v1": "Amazon: Nova Micro 1.0",
    "amazon/nova-premier-v1": "Amazon: Nova Premier 1.0",
    "amazon/nova-pro-v1": "Amazon: Nova Pro 1.0",
    "anthracite-org/magnum-v4-72b": "Magnum v4 72B",
    "anthropic/claude-fable-5": "Anthropic: Claude Fable 5",
    "anthropic/claude-fable-5.1": "Anthropic: Claude Fable 5.1",
    "anthropic/claude-fable-5.1:batch": "Anthropic: Claude Fable 5.1 (batch)",
    "anthropic/claude-fable-5:batch": "Anthropic: Claude Fable 5 (batch)",
    "anthropic/claude-haiku-4.5": "Anthropic: Claude Haiku 4.5",
    "anthropic/claude-haiku-4.5:batch": "Anthropic: Claude Haiku 4.5 (batch)",
    "anthropic/claude-haiku-5.5": "Anthropic: Claude Haiku 5.5",
    "anthropic/claude-haiku-5.5:batch": "Anthropic: Claude Haiku 5.5 (batch)",
    "anthropic/claude-opus-4.1": "Anthropic: Claude Opus 4.1",
    "anthropic/claude-opus-4.1:batch": "Anthropic: Claude Opus 4.1 (batch)",
    "anthropic/claude-opus-4.5": "Anthropic: Claude Opus 4.5",
    "anthropic/claude-opus-4.5:batch": "Anthropic: Claude Opus 4.5 (batch)",
    "anthropic/claude-opus-4.6": "Anthropic: Claude Opus 4.6",
    "anthropic/claude-opus-4.6:batch": "Anthropic: Claude Opus 4.6 (batch)",
    "anthropic/claude-opus-4.7": "Anthropic: Claude Opus 4.7",
    "anthropic/claude-opus-4.7:batch": "Anthropic: Claude Opus 4.7 (batch)",
    "anthropic/claude-opus-4.8": "Anthropic: Claude Opus 4.8",
    "anthropic/claude-opus-4.8:batch": "Anthropic: Claude Opus 4.8 (batch)",
    "anthropic/claude-opus-5": "Anthropic: Claude Opus 5",
    "anthropic/claude-opus-5.5": "Anthropic: Claude Opus 5.5",
    "anthropic/claude-opus-5.5:batch": "Anthropic: Claude Opus 5.5 (batch)",
    "anthropic/claude-opus-5:batch": "Anthropic: Claude Opus 5 (batch)",
    "anthropic/claude-sonnet-4.5": "Anthropic: Claude Sonnet 4.5",
    "anthropic/claude-sonnet-4.5:batch": "Anthropic: Claude Sonnet 4.5 (batch)",
    "anthropic/claude-sonnet-4.6": "Anthropic: Claude Sonnet 4.6",
    "anthropic/claude-sonnet-4.6:batch": "Anthropic: Claude Sonnet 4.6 (batch)",
    "anthropic/claude-sonnet-5": "Anthropic: Claude Sonnet 5",
    "anthropic/claude-sonnet-5.5": "Anthropic: Claude Sonnet 5.5",
    "anthropic/claude-sonnet-5.5:batch": "Anthropic: Claude Sonnet 5.5 (batch)",
    "anthropic/claude-sonnet-5:batch": "Anthropic: Claude Sonnet 5 (batch)",
    "arcee-ai/trinity-large-thinking": "Arcee AI: Trinity Large Thinking",
    "assemblyai/universal-3-5-pro": "AssemblyAI: Universal-3.5 Pro",
    "assemblyai/universal-3-6-pro": "AssemblyAI: Universal-3.6 Pro",
    "baai/bge-base-en-v1.5": "BAAI: bge-base-en-v1.5",
    "baai/bge-large-en-v1.5": "BAAI: bge-large-en-v1.5",
    "baai/bge-m3": "BAAI: bge-m3",
    "black-forest-labs/flux-3-image": "Black Forest Labs: FLUX 3 Image",
    "black-forest-labs/flux-3-image-klein": "Black Forest Labs: FLUX 3 Image Klein",
    "black-forest-labs/flux-3-video": "Black Forest Labs: FLUX 3 Video",
    "black-forest-labs/flux-video-edit": "Black Forest Labs: FLUX Video Edit",
    "black-forest-labs/flux-video-upscale": "Black Forest Labs: FLUX Video Upscale",
    "black-forest-labs/flux.2-flex": "Black Forest Labs: FLUX.2 Flex",
    "black-forest-labs/flux.2-klein-4b": "Black Forest Labs: FLUX.2 Klein 4B",
    "black-forest-labs/flux.2-max": "Black Forest Labs: FLUX.2 Max",
    "black-forest-labs/flux.2-pro": "Black Forest Labs: FLUX.2 Pro",
    "bytedance-seed/seed-1.6": "ByteDance Seed: Seed 1.6",
    "bytedance-seed/seed-1.6-flash": "ByteDance Seed: Seed 1.6 Flash",
    "bytedance-seed/seed-2-1-turbo": "ByteDance Seed: Seed 2.1 Turbo",
    "bytedance-seed/seed-2.0-code": "ByteDance Seed: Seed-2.0-Code",
    "bytedance-seed/seed-2.0-lite": "ByteDance Seed: Seed-2.0-Lite",
    "bytedance-seed/seed-2.0-mini": "ByteDance Seed: Seed-2.0-Mini",
    "bytedance-seed/seed-audio-1-0": "ByteDance Seed: Seed Audio 1.0",
    "bytedance-seed/seedream-4.5": "ByteDance Seed: Seedream 4.5",
    "bytedance-seed/seedream-5-0-flash": "ByteDance Seed: Seedream 5.0 Flash",
    "bytedance-seed/seedream-5-0-lite": "ByteDance Seed: Seedream 5.0 Lite",
    "bytedance-seed/seedream-5-0-pro": "ByteDance Seed: Seedream 5.0 Pro",
    "bytedance/seedance-1-5-pro": "ByteDance: Seedance 1.5 Pro",
    "bytedance/seedance-2.0": "ByteDance: Seedance 2.0",
    "bytedance/seedance-2.0-fast": "ByteDance: Seedance 2.0 Fast",
    "bytedance/seedance-2.0-mini": "ByteDance: Seedance 2.0 Mini",
    "bytedance/seedance-2.5": "ByteDance: Seedance 2.5",
    "bytedance/ui-tars-1.5-7b": "ByteDance: UI-TARS 7B",
    "canopylabs/orpheus-3b-0.1-ft": "Canopy Labs: Orpheus 3B",
    "cloudflare/clef": "Cloudflare: Clef",
    "cloudflare/clef-flash": "Cloudflare: Clef Flash",
    "cloudflare/clef-omni": "Cloudflare: Clef Omni",
    "cognitivecomputations/dolphin-mistral-24b-venice-edition": "Venice: Uncensored",
    "cohere/command-a": "Cohere: Command A",
    "cohere/command-a-plus": "Cohere: Command A+",
    "cohere/command-r-08-2024": "Cohere: Command R (08-2024)",
    "cohere/command-r-plus-08-2024": "Cohere: Command R+ (08-2024)",
    "cohere/command-r7b-12-2024": "Cohere: Command R7B (12-2024)",
    "cohere/north-mini-code:free": "Cohere: North Mini Code (free)",
    "cohere/rerank-4-fast": "Cohere: Rerank 4 Fast",
    "cohere/rerank-4-pro": "Cohere: Rerank 4 Pro",
    "cohere/rerank-v3.5": "Cohere: Rerank v3.5",
    "deepgram/aura-2": "Deepgram: Aura-2",
    "deepgram/flux-tts": "Deepgram: Flux TTS",
    "deepgram/nova-3": "Deepgram: Nova-3",
    "deepseek/deepseek-chat": "DeepSeek: DeepSeek V3",
    "deepseek/deepseek-chat-v3-0324": "DeepSeek: DeepSeek V3 0324",
    "deepseek/deepseek-chat-v3.1": "DeepSeek: DeepSeek V3.1",
    "deepseek/deepseek-r1-0528": "DeepSeek: R1 0528",
    "deepseek/deepseek-v3.1-terminus": "DeepSeek: DeepSeek V3.1 Terminus",
    "deepseek/deepseek-v3.2": "DeepSeek: DeepSeek V3.2",
    "deepseek/deepseek-v3.2-exp": "DeepSeek: DeepSeek V3.2 Exp",
    "deepseek/deepseek-v4-flash": "DeepSeek: DeepSeek V4 Flash 0423",
    "deepseek/deepseek-v4-flash-0731": "DeepSeek: DeepSeek V4 Flash 0731",
    "deepseek/deepseek-v4-flash-vision-exp": "DeepSeek: DeepSeek V4 Flash Vision Exp",
    "deepseek/deepseek-v4-pro": "DeepSeek: DeepSeek V4 Pro 0423",
    "deepseek/deepseek-v4-pro-0813": "DeepSeek: DeepSeek V4 Pro 0813",
    "deepseek/deepseek-v4.1-flash": "DeepSeek: DeepSeek V4.1 Flash",
    "deepseek/deepseek-v4.1-flash-1017": "DeepSeek: DeepSeek V4.1 Flash 1017",
    "deepseek/deepseek-v4.1-flash:batch": "DeepSeek: DeepSeek V4.1 Flash (batch)",
    "dots-studio/dots-3-note-preview:free": "Dots Studio: Dots3-Note Preview (free)",
    "elevenlabs/eleven-flash-v2": "ElevenLabs: Eleven Flash v2",
    "elevenlabs/eleven-flash-v2.5": "ElevenLabs: Eleven Flash v2.5",
    "elevenlabs/eleven-multilingual-v2": "ElevenLabs: Eleven Multilingual v2",
    "elevenlabs/eleven-turbo-v2": "ElevenLabs: Eleven Turbo v2",
    "elevenlabs/eleven-turbo-v2.5": "ElevenLabs: Eleven Turbo v2.5",
    "elevenlabs/eleven-v3": "ElevenLabs: Eleven v3",
    "elevenlabs/eleven-v3-conversational": "ElevenLabs: Eleven v3 Conversational",
    "elevenlabs/eleven-v4": "ElevenLabs: Eleven v4",
    "elevenlabs/eleven-v4-turbo": "ElevenLabs: Eleven v4 Turbo",
    "elevenlabs/scribe-v2": "ElevenLabs: Scribe v2",
    "elevenlabs/scribe-v2-medical": "ElevenLabs: Scribe v2 Medical",
    "elorian/glimpse": "Elorian: Glimpse",
    "fireworks/ember-1": "Fireworks: Ember-1",
    "fish-audio/drama-3": "Fish Audio: Drama 3",
    "fish-audio/s1": "Fish Audio: S1",
    "fish-audio/s2-pro": "Fish Audio: S2 Pro",
    "fish-audio/s2.1-pro": "Fish Audio: S2.1 Pro",
    "fish-audio/s2.1-pro-free:free": "Fish Audio: S2.1 Pro Free (free)",
    "fish-audio/transcribe-1": "Fish Audio: Transcribe 1",
    "fish-audio/transcribe-1-pro": "Fish Audio: Transcribe 1 Pro",
    "google/chirp-3": "Google: Chirp 3",
    "google/gemini-2.5-flash": "Google: Gemini 2.5 Flash",
    "google/gemini-2.5-flash-image": "Google: Nano Banana (Gemini 2.5 Flash Image)",
    "google/gemini-2.5-flash-lite": "Google: Gemini 2.5 Flash Lite",
    "google/gemini-2.5-flash-lite:batch": "Google: Gemini 2.5 Flash Lite (batch)",
    "google/gemini-2.5-flash:batch": "Google: Gemini 2.5 Flash (batch)",
    "google/gemini-2.5-pro": "Google: Gemini 2.5 Pro",
    "google/gemini-2.5-pro-preview": "Google: Gemini 2.5 Pro Preview 06-05",
    "google/gemini-2.5-pro:batch": "Google: Gemini 2.5 Pro (batch)",
    "google/gemini-3-flash-preview": "Google: Gemini 3 Flash Preview",
    "google/gemini-3-flash-preview:batch": "Google: Gemini 3 Flash Preview (batch)",
    "google/gemini-3-pro-image": "Google: Nano Banana Pro (Gemini 3 Pro Image)",
    "google/gemini-3-pro-image-preview": "Google: Nano Banana Pro (Gemini 3 Pro Image Preview)",
    "google/gemini-3.1-flash-image": "Google: Nano Banana 2 (Gemini 3.1 Flash Image)",
    "google/gemini-3.1-flash-image-preview": "Google: Nano Banana 2 (Gemini 3.1 Flash Image Preview)",